index,id,txt,GRNB,FUND,IND,UNI,COR,MISC;;;;;;;;;;;;;;;;;;;;;;;;;;;;;;;;;;;;;;;;;;;;;;;;;;;;;;;;;;;;;;;;;;;;;;;;;;
968,8845546,We wish to gratefully acknowledge the Biological Mass Spectrometry Core Research Facility at the University of Manchester for access to their facilities.,,,,Biological Mass Spectrometry Core Research Facility at the University of Manchester,,;;;;;;;;;;;;;;;;;;;;;;;;;;;;;;;;;;;;;;;;;;;;;;;;;;;;;;;;;;;;;;;;;;;;;;;;;;
"969,8845546,""Many thanks also go to Umberto Albarella and Angelos Hadjikoumis of the University of Sheffield, Dr. Hannah Russ of University of Wales Trinity Saint David, Creswell Crags Museum and Holly Shiels laboratory at the University of Manchester for assisting with the provisions of modern reference material for comparative analyses."",,,Umberto Albarella";Angelos Hadjikoumis;Hannah Russ,University of Sheffield;University of Wales Trinity Saint David;Holly Shiels laboratory at the University of Manchester,,Creswell Crags Museum;;;;;;;;;;;;;;;;;;;;;;;;;;;;;;;;;;;;;;;;;;;;;;;;;;;;;;;;;;;;;;;;;;;;;;
"970,8845546,""We are also deeply grateful to Rimute Rimantiene, Edvinas Ubis, Gintautas Zabiela and Algirdas Girininkas for their roles in excavating the bioarcheological material analysed in this study."",,,Rimute Rimantiene";Edvinas Ubis;Gintautas Zabiela;Algirdas Girininkas,,,;;;;;;;;;;;;;;;;;;;;;;;;;;;;;;;;;;;;;;;;;;;;;;;;;;;;;;;;;;;;;;;;;;;;;;;
"971,8845546,""Finally, we gratefully acknowledge the support of the Royal Society for fellowship (UF120473) funding to MB as well as the University of Manchester Dean's Award for scholarship funding to VH."",UF120473,Royal Society,,University of Manchester Dean's Award,,";;;;;;;;;;;;;;;;;;;;;;;;;;;;;;;;;;;;;;;;;;;;;;;;;;;;;;;;;;;;;;;;;;;;;;;;;;
"972,8846036,""The research in this article is funded by an Insight grant from the Social Sciences and Humanities Research Council of Canada, project number 435-2016-0933."",435-2016-0933,Social Sciences and Humanities Research Council of Canada,,,,";;;;;;;;;;;;;;;;;;;;;;;;;;;;;;;;;;;;;;;;;;;;;;;;;;;;;;;;;;;;;;;;;;;;;;;;;;
"973,8864298,""This work was supported by the Economic and Social Research Council (UK) and the UK Department for International Development as part of the 'Governing Food Systems to Alleviate Poverty in Secondary Cities in Africa' project, funded under the ESRC-DFID Joint Fund for Poverty Alleviation Research (Poverty in Urban Spaces theme) [grant number ES/L008610/1]."",ES/L008610/1,UK Department for International Development";Economic and Social Research Council (UK);ESRC-DFID Joint Fund for Poverty Alleviation Research (Poverty in Urban Spaces theme) ,,,,Governing Food Systems to Alleviate Poverty in Secondary Cities in Africa;;;;;;;;;;;;;;;;;;;;;;;;;;;;;;;;;;;;;;;;;;;;;;;;;;;;;;;;;;;;;;;;;;;;;;;;
974,8875990,This work was supported by the Nederlandse Organisatie voor Wetenschappelijk Onderzoek [CLARIAH-CORE];Jan Wallanders och Tom Hedelius Stiftelse;Tore Browaldhs stiftelse [Dnr: P2015-0159 and P2015-0409:1];South African National Research Foundation [96248]; Marianne och Marcus forskningsstiftelser [Dnr: MMW 2015.0027].,P2015-0409:1;MMW 2015.0027;96248;P2015-0159,South African National Research Foundation;Jan Wallanders och Tom Hedelius Stiftelse;Nederlandse Organisatie voor Wetenschappelijk Onderzoek [CLARIAH-CORE];Tore Browaldhs stiftelse;Marianne och Marcus forskningsstiftelser,,,,;;;;;;;;;;;;;;;;;;;;;;;;;;;;;;;;;;;;;;;;;;;;;;;;;;;;;;;;;;;;;;;
975,8879177,The research presented in this paper is supported by the National Natural Science Foundation of China (71271168;70871097;71390331;71732006; 71731009).,70871097;71731009;71390331;71732006;71271168,National Natural Science Foundation of China,,,,;;;;;;;;;;;;;;;;;;;;;;;;;;;;;;;;;;;;;;;;;;;;;;;;;;;;;;;;;;;;;;;;;;
"976,8895073,""We acknowledge the financial support from the National Natural Science Foundation of China (grant nos. 51475179 and 51679099), and the Fundamental Research Funds for the Central Universities HUST."",51679099";51475179,National Natural Science Foundation of China;Fundamental Research Funds for the Central Universities HUST,,,,;;;;;;;;;;;;;;;;;;;;;;;;;;;;;;;;;;;;;;;;;;;;;;;;;;;;;;;;;;;;;;;;;;;;;;;;
977,8895073,2016JCTD207.,2016JCTD207,,,,,;;;;;;;;;;;;;;;;;;;;;;;;;;;;;;;;;;;;;;;;;;;;;;;;;;;;;;;;;;;;;;;;;;;;;;;;;;
978,8900341,This research was supported by the National Institutes of Health (1R15HD071935-01) and the Vermont Genetics Network (via NIH INBRE1 P20 RR16462).,NIH INBRE1 P20 RR16462;1R15HD071935-01,National Institutes of Health,,Vermont Genetics Network,,;;;;;;;;;;;;;;;;;;;;;;;;;;;;;;;;;;;;;;;;;;;;;;;;;;;;;;;;;;;;;;;;;;;;;;;;;
979,8903047,This work was done under the project number (CL/SQU-UAEU/16/05) which was funded from the joint research project in Sultan Qaboos University in Oman.,CL/SQU-UAEU/16/05,,,Sultan Qaboos University in Oman,,;;;;;;;;;;;;;;;;;;;;;;;;;;;;;;;;;;;;;;;;;;;;;;;;;;;;;;;;;;;;;;;;;;;;;;;;;;
980,8916284,This work was funded by a BUPA Foundation Fund Innovation Grant from Cancer Research UK (Award reference: C49248/A23538).,C49248/A23538,BUPA Foundation Fund Innovation Grant from Cancer Research UK,,,,;;;;;;;;;;;;;;;;;;;;;;;;;;;;;;;;;;;;;;;;;;;;;;;;;;;;;;;;;;;;;;;;;;;;;;;;;;
981,8916284,EM is funded under Health and Social Care Northern Ireland and National Cancer Institute Health Economics Fellowship (Grant: CDV/4980/14).,CDV/4980/14,National Cancer Institute Health Economics Fellowship,,,,;;;;;;;;;;;;;;;;;;;;;;;;;;;;;;;;;;;;;;;;;;;;;;;;;;;;;;;;;;;;;;;;;;;;;;;;;;
982,8916284,RJB is funded by a Yorkshire Cancer Research Academic Fellowship.,,Yorkshire Cancer Research Academic Fellowship,,,,;;;;;;;;;;;;;;;;;;;;;;;;;;;;;;;;;;;;;;;;;;;;;;;;;;;;;;;;;;;;;;;;;;;;;;;;;;
983,9007261,This work was supported by the Russian Science Foundation Grant #18-11-00336.,18-11-00336,Russian Science Foundation,,,,;;;;;;;;;;;;;;;;;;;;;;;;;;;;;;;;;;;;;;;;;;;;;;;;;;;;;;;;;;;;;;;;;;;;;;;;;;
984,9007261,The authors are grateful to the NRNU MEPhI Academic Excellence Project for providing computing resources and facilities to perform the experiments and data analysis.,,,,NRNU MEPhI Academic Excellence Project,,;;;;;;;;;;;;;;;;;;;;;;;;;;;;;;;;;;;;;;;;;;;;;;;;;;;;;;;;;;;;;;;;;;;;;;;;;;
985,9007261,The authors are also very grateful to all NRNU MEPhI Students who participated in this study.,,,,NRNU MEPhI,,;;;;;;;;;;;;;;;;;;;;;;;;;;;;;;;;;;;;;;;;;;;;;;;;;;;;;;;;;;;;;;;;;;;;;;;;;;
986,9024816,We thank Hannah Schwartz and Harry Rowe for assistance with data collection and stimuli creation.,,,Hannah Schwartz;Harry Rowe,,,;;;;;;;;;;;;;;;;;;;;;;;;;;;;;;;;;;;;;;;;;;;;;;;;;;;;;;;;;;;;;;;;;;;;;;;;;
987,9024816,This work was partially supported by a General University Research Fund (UD) and NSF BCS grant #1632849.,1632849,NSF BCS,,General University Research Fund (UD),,;;;;;;;;;;;;;;;;;;;;;;;;;;;;;;;;;;;;;;;;;;;;;;;;;;;;;;;;;;;;;;;;;;;;;;;;;;
"988,9060289,""Universidad Autonoma de Nayarit and the program PFCE, Grant/Award Number: PFCE-2016-182 MSU0019M-04"",PFCE-2016-182 MSU0019M-04,PFCE,,Universidad Autonoma de Nayarit,,";;;;;;;;;;;;;;;;;;;;;;;;;;;;;;;;;;;;;;;;;;;;;;;;;;;;;;;;;;;;;;;;;;;;;;;;;;
989,9062753,This research was funded by the Great Lakes Sustainability Fund managed by Environment and Climate Change Canada (Grant no. GCXE17P131).,GCXE17P131,Great Lakes Sustainability Fund;Environment and Climate Change Canada,,,,;;;;;;;;;;;;;;;;;;;;;;;;;;;;;;;;;;;;;;;;;;;;;;;;;;;;;;;;;;;;;;;;;;;;;;;;;
"990,9097380,""This work was supported by the College of Nursing of the Region of Murcia, Spain [grant Number 1221/13]."",1221/13,,,""College of Nursing of the Region of Murcia, Spain"",,";;;;;;;;;;;;;;;;;;;;;;;;;;;;;;;;;;;;;;;;;;;;;;;;;;;;;;;;;;;;;;;;;;;;;;;;;;
"991,9112211,""Ministerstvo Zemedelstvi, Grant/Award Number: QJ1210237.";" Ministry of Education, Youth and Sports of the Czech Republic 418 project CENAKVA, CENAKVA II"",QJ1210237,""Ministerstvo Zemedelstvi";"Ministry of Education, Youth and Sports of the Czech Republic"",,,,CENAKVA";CENAKVA II;;;;;;;;;;;;;;;;;;;;;;;;;;;;;;;;;;;;;;;;;;;;;;;;;;;;;;;;;;;;;;;;;;;;;;;
992,9134318,We would like to thank Morgan Furman and Chelsea Birchmier for assistance with data collection and for helpful discussion of the research presented in this manuscript.,,,Morgan Furman;Chelsea Birchmier,,,;;;;;;;;;;;;;;;;;;;;;;;;;;;;;;;;;;;;;;;;;;;;;;;;;;;;;;;;;;;;;;;;;;;;;;;;;
993,9134318,N.T.D. was supported by an NIA Training Grant (T32AG000030-40).,T32AG000030-40,NIA Training Grant,,,,;;;;;;;;;;;;;;;;;;;;;;;;;;;;;;;;;;;;;;;;;;;;;;;;;;;;;;;;;;;;;;;;;;;;;;;;;;
994,9134318,Avishai Henik served as action editor for this manuscript.,,,Avishai Henik,,,;;;;;;;;;;;;;;;;;;;;;;;;;;;;;;;;;;;;;;;;;;;;;;;;;;;;;;;;;;;;;;;;;;;;;;;;;;
995,9143697,This research was funded by UCLA COR Faculty Research Grant (2011-12) and NSF BCS-0951639 to MS.,BCS-0951639,NSF,,UCLA COR Faculty Research Grant,,;;;;;;;;;;;;;;;;;;;;;;;;;;;;;;;;;;;;;;;;;;;;;;;;;;;;;;;;;;;;;;;;;;;;;;;;;;
"996,9143697,""We would like to thank Dulce Montoya for recording the stimuli and Chad Vicenik, Robyn Orfitelli, Anya Mancillas, Hadley Stork, and Guadalupe Ramirez for help with recruiting and testing infants."",,,Dulce Montoya";Chad Vicenik;Robyn Orfitelli;Anya Mancillas;Hadley Stork;Guadalupe Ramirez,,,;;;;;;;;;;;;;;;;;;;;;;;;;;;;;;;;;;;;;;;;;;;;;;;;;;;;;;;;;;;;;;;;;;;;;
"997,9143697,""Parts of this research were presented at the Workshop on Infant Language Development, San Sebastian, Spain (June 2013)."",,,,,,""Workshop on Infant Language Development, San Sebastian, Spain """;;;;;;;;;;;;;;;;;;;;;;;;;;;;;;;;;;;;;;;;;;;;;;;;;;;;;;;;;;;;;;;;;;;;;;;;;;
"998,9151325,""This study was supported by the Consejo Nacional de Ciencia y Tecnologia (CONACyT, CB-2009-01 133923) and by the National Institute on Minority Health and Health Disparities (T37 MD003405-06)."",CB-2009-01 133923";T37 MD003405-06,National Institute on Minority Health and Health Disparities;Consejo Nacional de Ciencia y Tecnologia;CONACyT,,,,;;;;;;;;;;;;;;;;;;;;;;;;;;;;;;;;;;;;;;;;;;;;;;;;;;;;;;;;;;;;;;;;;;;;;;;
"999,9151325,""We are grateful to Dr. Jose Luis Navarro, Director of the Centro de Salud Dr. Angel Brioso Vasconcelos and to Dr. Juan Pablo Barba Martin, Coordinator of Obstetrics and Gynecology of the Hospital Regional del ISSSTE Lic. Adolfo Lopez Mateos."",,,Jose Luis Navarro";Angel Brioso Vasconcelos;Juan Pablo Barba Martin;Adolfo Lopez Mateos,,,Coordinator of Obstetrics and Gynecology of the Hospital Regional del ISSSTE ;;;;;;;;;;;;;;;;;;;;;;;;;;;;;;;;;;;;;;;;;;;;;;;;;;;;;;;;;;;;;;;;;;;;;;;
"1000,9151325,""Thanks are also due to the research team: Yadira Ramos, Karla Alcantara and Valeria Zempoalteca, and to Ricardo Orozco for his statistical assistance."",,,Yadira Ramos";Karla Alcantara;Valeria Zempoalteca;Ricardo Orozco,,,;;;;;;;;;;;;;;;;;;;;;;;;;;;;;;;;;;;;;;;;;;;;;;;;;;;;;;;;;;;;;;;;;;;;;;;
"1001,9162740,""This work is partially supported by two projects: the Serbian Ministry of Education, Science and Technological Development through project no. OI174023 and Tematic network project: """"FETCH - Future Education and Training in Computing: How to support learning at anytime anywhere""""."",OI174023,""Serbian Ministry of Education, Science and Technological Development";"FETCH"",,,,Future Education and Training in Computing: How to support learning at anytime anywhere";;;;;;;;;;;;;;;;;;;;;;;;;;;;;;;;;;;;;;;;;;;;;;;;;;;;;;;;;;;;;;;;;;;;;;;;;
"1002,9170785,""This work was supported in part by grants from the Indonesian Directorate of Higher Education-APBN/DIPA UNS (No. 501/UN27.11/PN/2014 and No. 339/UN27.11/PL/2015), and from the Indonesian Ministry of Research, Technology and Higher Education (No 353/ UN 27.21/ PN/ 2016 and No 873/ UN27.21/ PP/ 2017)."",353/ UN 27.21/ PN/ 2016";873/ UN27.21/ PP/ 2017;339/UN27.11/PL/2015;"501/UN27.11/PN/2014,""Indonesian Ministry of Research, Technology and Higher Education";"Indonesian Directorate of Higher Education-APBN/DIPA UNS"",,,,";;;;;;;;;;;;;;;;;;;;;;;;;;;;;;;;;;;;;;;;;;;;;;;;;;;;;;;;;;;;;;;;;;;;;;
1003,9177825,The study was financially supported by the National Science Foundation of China (Grant Ref. No. 81541122).,81541122,National Science Foundation of China,,,,;;;;;;;;;;;;;;;;;;;;;;;;;;;;;;;;;;;;;;;;;;;;;;;;;;;;;;;;;;;;;;;;;;;;;;;;;;
1004,9184486,This work was supported by a grant from the Shanghai Planning Office of Philosophy and Social Science (2014JJY001).,2014JJY001,Shanghai Planning Office of Philosophy and Social Science,,,,;;;;;;;;;;;;;;;;;;;;;;;;;;;;;;;;;;;;;;;;;;;;;;;;;;;;;;;;;;;;;;;;;;;;;;;;;;
"1005,9215943,""This work was supported by the National Natural Science Foundation of China under Grant 51575048, the Beijing Natural Science Foundation under Grant 4162055, and China Scholarship Council under grant 201706035010."",51575048";2,01706E+11;4162055,National Natural Science Foundation of China;Beijing Natural Science Foundation;China Scholarship Council,,,,;;;;;;;;;;;;;;;;;;;;;;;;;;;;;;;;;;;;;;;;;;;;;;;;;;;;;;;;;;;;;;;;;;;;;;
"1006,9233696,""This work was supported by the Programs of the Qingdao National Laboratory for Marine Science and Technology [grant numbers 2016ASKJ02]"; Strategic Priority Research Program of Chinese Academy of Sciences (CAS) [grant number XDA11020304];" National Natural Science Foundation project [grant number 41676106], the project jointly supported by Shandong province and the National Natural Science Foundation of China (NSFC) [grant number U1606404]."",U1606404";2016ASKJ02;41676106;XDA11020304,National Natural Science Foundation of China (NSFC);Qingdao National Laboratory for Marine Science and Technology;National Natural Science Foundation;Shandong province,,Strategic Priority Research Program of Chinese Academy of Sciences (CAS),,;;;;;;;;;;;;;;;;;;;;;;;;;;;;;;;;;;;;;;;;;;;;;;;;;;;;;;;;;;;;;;;;;;
"1007,9233696,""We deeply appreciate the valuable comments of Professor Petitjean Jenkinson, and assistance of Zhen-Jun Kang, Jian-Hua Chen, Shi-Liang Fan and Yan Li for the collection of green algal samples.[SS]"",,,Petitjean Jenkinson";Zhen-Jun Kang;Jian-Hua Chen;Shi-Liang Fan;Yan Li,,,;;;;;;;;;;;;;;;;;;;;;;;;;;;;;;;;;;;;;;;;;;;;;;;;;;;;;;;;;;;;;;;;;;;;;;
1008,9249484,This research has been supported by National Natural Science Foundation program of China (51035007).,51035007,National Natural Science Foundation program of China,,,,;;;;;;;;;;;;;;;;;;;;;;;;;;;;;;;;;;;;;;;;;;;;;;;;;;;;;;;;;;;;;;;;;;;;;;;;;;
"1009,9253498,""We would like to thank Sarah Shand, Katie Quinn, Lauren Ferguson, Sarah McFarline, Gillian Little, Claire McGuire, and Niamh McGlinchey for their help with data collection and response coding, and Gnanathusharan Rajendran and Holly Branigan for their advice."",,,Sarah Shand";Katie Quinn;Lauren Ferguson;Sarah McFarline;Gillian Little;Claire McGuire;Niamh McGlinchey;Gnanathusharan Rajendran;Holly Branigan,,,;;;;;;;;;;;;;;;;;;;;;;;;;;;;;;;;;;;;;;;;;;;;;;;;;;;;;;;;;;;;;;;;;;
1010,9253498,This research was funded by British Academy Grant SG110582.,SG110582,,,British Academy Grant,,;;;;;;;;;;;;;;;;;;;;;;;;;;;;;;;;;;;;;;;;;;;;;;;;;;;;;;;;;;;;;;;;;;;;;;;;;;
"1011,9299421,""The European Union and the Spanish Government funded this study through the HEATGRASS (Tolerance to heat stress induced by climate change in the seagrass Posidonia oceanica, #624035) and RECCAM (Seagrass Meadows resilience to global warming: an analysis based on responses at ecophysiological, population and ecosystem levels, CTM2013-48027-C3-1/2/3-R) projects."",CTM2013-48027-C3-1/2/3-R";624035,Spanish Government;European Union;HEATGRASS;RECCAM,,,,;;;;;;;;;;;;;;;;;;;;;;;;;;;;;;;;;;;;;;;;;;;;;;;;;;;;;;;;;;;;;;;;;;;;;;
1012,9299421,The Spanish National Research Council supported RA's visitorship (CSIC-201330E062).,CSIC-201330E062,Spanish National Research Council,,,,;;;;;;;;;;;;;;;;;;;;;;;;;;;;;;;;;;;;;;;;;;;;;;;;;;;;;;;;;;;;;;;;;;;;;;;;;;
"1013,9324083,""We appreciate for the anonymous referees' comments on this paper, which significantly improved this paper."",,,,,,";;;;;;;;;;;;;;;;;;;;;;;;;;;;;;;;;;;;;;;;;;;;;;;;;;;;;;;;;;;;;;;;;;;;;;;;;;
1014,9324083,This work is supported by the National Natural Science Foundation of China (Grant nos. 71572021 and 71771189) and the Fundamental Research Funds for the Central Universities (Project No. 2018CDXYJG0040).,71572021;2018CDXYJG0040;71771189,National Natural Science Foundation of China;Fundamental Research Funds for the Central Universities,,,,;;;;;;;;;;;;;;;;;;;;;;;;;;;;;;;;;;;;;;;;;;;;;;;;;;;;;;;;;;;;;;;;;;;;;;;
"1015,9324504,""This work is supported by the National Natural Science Foundation of China under Grants 61772345, 61402294, 61732011 and 61672358, Major Fundamental Research Project in the Science and Technology Plan of Shenzhen, China under Grants JCYJ20160310095523765 and JCYJ20160307111232895."",61672358";JCYJ20160307111232895;JCYJ20160310095523765;61732011;61772345;"61402294,""National Natural Science Foundation of China";"Major Fundamental Research Project in the Science and Technology Plan of Shenzhen, China"",,,,";;;;;;;;;;;;;;;;;;;;;;;;;;;;;;;;;;;;;;;;;;;;;;;;;;;;;;;;;;;;;;;;;;;;
1016,9394196,The authors would like to thank the EPSRC for its financial support through Lancaster University's Impact Acceleration Account (Grant Reference EP/K50421X/1).,EP/K50421X/1,EPSRC,,Lancaster University's Impact Acceleration Account,,;;;;;;;;;;;;;;;;;;;;;;;;;;;;;;;;;;;;;;;;;;;;;;;;;;;;;;;;;;;;;;;;;;;;;;;;;;
"1017,9409294,""This work is co-supported by the Fundamental Research Funds for the Central Universities, the National Key Basic Research and Development Program (Grant No. 2014CB046401) and the National Natural Science Foundation of China (Grant No. 51775014)."",51775014";2014CB046401,National Natural Science Foundation of China;National Key Basic Research and Development Program;Fundamental Research Funds for the Central Universities,,,,;;;;;;;;;;;;;;;;;;;;;;;;;;;;;;;;;;;;;;;;;;;;;;;;;;;;;;;;;;;;;;;;;;;;;;;
1018,9410775,The authors would like to thank the four anonymous reviewers for all the constructive and helpful review comments that have helped improved the manuscript significantly.,,,,,,;;;;;;;;;;;;;;;;;;;;;;;;;;;;;;;;;;;;;;;;;;;;;;;;;;;;;;;;;;;;;;;;;;;;;;;;;;
1019,9410775,This work was supported by the Natural Science Basic Research Plan of Shaanxi Province of China (Grant number 2015JM6296).,2015JM6296,Natural Science Basic Research Plan of Shaanxi Province of China,,,,;;;;;;;;;;;;;;;;;;;;;;;;;;;;;;;;;;;;;;;;;;;;;;;;;;;;;;;;;;;;;;;;;;;;;;;;;;
1020,9416897,This work was supported by the Wellcome Trust [097897/Z/11/Z].,097897/Z/11/Z,Wellcome Trust,,,,;;;;;;;;;;;;;;;;;;;;;;;;;;;;;;;;;;;;;;;;;;;;;;;;;;;;;;;;;;;;;;;;;;;;;;;;;;
"1021,9423926,""The project was funded by the Elite Network of Bavaria, an initiative of the Bavarian Ministry of Education, Science and the Arts (Project number: K-GS-2012-209)."",K-GS-2012-209,""Elite Network of Bavaria";"Bavarian Ministry of Education, Science and the Arts"",,,,";;;;;;;;;;;;;;;;;;;;;;;;;;;;;;;;;;;;;;;;;;;;;;;;;;;;;;;;;;;;;;;;;;;;;;;;;
"1022,9438054,""This project was supported by RTOG grant U10 CA21661, CCOP grant U10 CA37422, and UG1CA189867 and U10CA180868 from the National Cancer Institute (NCI)."",UG1CA189867";U10CA180868;U10 CA21661;U10 CA37422,RTOG;CCOP;National Cancer Institute (NCI),,,,;;;;;;;;;;;;;;;;;;;;;;;;;;;;;;;;;;;;;;;;;;;;;;;;;;;;;;;;;;;;;;;;;;;;;
"1023,9438054,""This project is funded, in part, under a grant with the Pennsylvania Department of Health."",,Pennsylvania Department of Health,,,,";;;;;;;;;;;;;;;;;;;;;;;;;;;;;;;;;;;;;;;;;;;;;;;;;;;;;;;;;;;;;;;;;;;;;;;;;;
"1024,9438054,""The Department specifically declaims responsibility for any analyses, interpretations, or conclusions."",,,,,,";;;;;;;;;;;;;;;;;;;;;;;;;;;;;;;;;;;;;;;;;;;;;;;;;;;;;;;;;;;;;;;;;;;;;;;;;;
1025,9458223,This work was supported by The River Foundation under grant The River Fund No. 285311020; and The Japan Society for the Promotion Science under grant KAKENHI No. 17K15345 and No. 17J09125; and Water Resources Environment Center under grant The WEC Applied Ecology Research Grant No. 2016-02.,285311020;17J09125;17K15345;2016-02,River Foundation;The River Fund;Japan Society for the Promotion Science;KAKENHI;Water Resources Environment Center ;The WEC Applied Ecology Research,,,,;;;;;;;;;;;;;;;;;;;;;;;;;;;;;;;;;;;;;;;;;;;;;;;;;;;;;;;;;;;;;;;;
"1026,9477991,""This work was supported by the National Key R&D Program of China (No. 2017YFB0802600), the National Natural Science Foundation of China (Nos. 61772403 and U1401251), the Natural Science Basic Research Plan in Shaanxi Province of China (No. 2017JM6004), and National 111 Program of China (Nos. B16037 and B08038)."",2017YFB0802600";B08038;2017JM6004;U1401251;61772403;B16037,National Key R&D Program of China;National 111 Program of China;Natural Science Basic Research Plan in Shaanxi Province of China;National Natural Science Foundation of China,,,,;;;;;;;;;;;;;;;;;;;;;;;;;;;;;;;;;;;;;;;;;;;;;;;;;;;;;;;;;;;;;;;;;;
"1027,9487058,""This work was supported by the Spanish Government (EDU2012-33593, EDU2016-76857-P)."",EDU2016-76857-P";EDU2012-33593,Spanish Government,,,,;;;;;;;;;;;;;;;;;;;;;;;;;;;;;;;;;;;;;;;;;;;;;;;;;;;;;;;;;;;;;;;;;;;;;;;;;
"1028,9487058,""The authors would like to express their thanks to Mercedes Marcos, professor at the Philology Faculty of Salamanca University (Spain), for the support received and her kind answers to all our questions on different linguistic issues."",,,Mercedes Marcos,Philology Faculty of Salamanca University (Spain),,";;;;;;;;;;;;;;;;;;;;;;;;;;;;;;;;;;;;;;;;;;;;;;;;;;;;;;;;;;;;;;;;;;;;;;;;;;
"1029,9487058,""In addition, the authors would like to thank the editor of this paper, David Poveda, and two anonymous reviewers who, through their work and suggestions, have helped to improve this study and clarify its contribution to the field."",,,David Poveda,,,";;;;;;;;;;;;;;;;;;;;;;;;;;;;;;;;;;;;;;;;;;;;;;;;;;;;;;;;;;;;;;;;;;;;;;;;;;
"1030,9492130,""We thank Jelle Eygensteyn, Paul van de Ven, and Rutger van Hall for analysing samples."",,,Jelle Eygensteyn";Paul van de Ven;Rutger van Hall,,,;;;;;;;;;;;;;;;;;;;;;;;;;;;;;;;;;;;;;;;;;;;;;;;;;;;;;;;;;;;;;;;;;;;;;;;;
"1031,9492130,""In addition, we thank Jim de Fouw, Jan van Gils (Mauritania), Evelyn van den Ent (France, the Netherlands, Germany), Aschwin Engelen (Portugal), Tjisse van der Heide, Leon Lamers, Fons Smolders (Australia), Jan de Brouwer (Caribbean), Sjoerd van der Zon, Sarah Engelhard, Tom van der Meer (Indonesia) for their assistance with sample collection."",,,Jim de Fouw";Jan van Gils;Evelyn van den Ent;Aschwin Engelen;Tjisse van der Heide;Leon Lamers;Fons Smolders;Jan de Brouwer;Sjoerd van der Zon;Sarah Engelhard;Tom van der Meer,,,;;;;;;;;;;;;;;;;;;;;;;;;;;;;;;;;;;;;;;;;;;;;;;;;;;;;;;;;;;;;;;;;
"1032,9492130,""The work in Banc d'Arguin, Mauritania was supported by the staff and director of Parc National du Banc d'Arguin (PNBA)."",,,,,,Parc National du Banc d'Arguin (PNBA)";;;;;;;;;;;;;;;;;;;;;;;;;;;;;;;;;;;;;;;;;;;;;;;;;;;;;;;;;;;;;;;;;;;;;;;;;;
"1033,9492130,""The work in Shark Bay, Australia was supported by the University of Western Australia (Gary Kendrick, John Statton, Matthew Fraser, Dianne Walker) and the Department of Environment and Conservation (DEC, David Holley)."",,Department of Environment and Conservation,Gary Kendrick";John Statton;Matthew Fraser;Dianne Walker;David Holley,University of Western Australia,,;;;;;;;;;;;;;;;;;;;;;;;;;;;;;;;;;;;;;;;;;;;;;;;;;;;;;;;;;;;;;;;;;;;;;;
"1034,9492130,""The work on Sylt, Germany was supported by the Alfred Wegner Institute (AWI, Raghnild Asmus, Dominik Kneer) and the work in Brittany, France, was supported by Laurent Godet (University of Nantes)."",,,Laurent Godet,Alfred Wegner Institute";AWI;University of Nantes,,;;;;;;;;;;;;;;;;;;;;;;;;;;;;;;;;;;;;;;;;;;;;;;;;;;;;;;;;;;;;;;;;;;;;;;;;
"1035,9492130,""The work in the Derawan Archipelago, Indonesia was supported by the Indonesian Institute of Sciences (LIPI, Wawan Kiswara, Suharsono)."",,,,Indonesian Institute of Sciences";LIPI,,;;;;;;;;;;;;;;;;;;;;;;;;;;;;;;;;;;;;;;;;;;;;;;;;;;;;;;;;;;;;;;;;;;;;;;;;;
1036,9492130,MJAC was supported by NWO (ALW-Caribbean program 858.14092 and East Kalimantan Program WT84-645).,858.14092;WT84-645,NWO,,,,ALW-Caribbean program;East Kalimantan Program;;;;;;;;;;;;;;;;;;;;;;;;;;;;;;;;;;;;;;;;;;;;;;;;;;;;;;;;;;;;;;;;;;;;;;;;
"1037,9512916,""This work was supported by the Fondazione Cassa di Risparmio di Trento e Rovereto [2012.0159] """"Bando per progetti di valorizzazione della memoriadelle comunita""""."",2012.0159,Fondazione Cassa di Risparmio di Trento e Rovereto,,,,";;;;;;;;;;;;;;;;;;;;;;;;;;;;;;;;;;;;;;;;;;;;;;;;;;;;;;;;;;;;;;;;;;;;;;;;;;
1038,9527007,This study is supported by National Natural Science Foundation of China (grant numbers 71573078; 71473076).,71473076;71573078,National Natural Science Foundation of China,,,,;;;;;;;;;;;;;;;;;;;;;;;;;;;;;;;;;;;;;;;;;;;;;;;;;;;;;;;;;;;;;;;;;;;;;;;;
1039,9547223,This work has been partially funded by NSERC (IPS application ID 486401) and the EU H2020 BigClout project (Grant Agreement N723139),N723139;486401,EU H2020 BigClout;NSERC,,,,;;;;;;;;;;;;;;;;;;;;;;;;;;;;;;;;;;;;;;;;;;;;;;;;;;;;;;;;;;;;;;;;;;;;;;;;
"1040,9557713,""This original research has not been published elsewhere and was supported by a fellowship from the Portuguese national funding agency for science, research and technology [FCT";" (SFRH/BD/70011/2010/Psicologia)] to the first author and by a research grant from the BIAL Foundation (No. 234/14) to the second author."",234/14";"SFRH/BD/70011/2010/Psicologia,""BIAL Foundation";Portuguese national funding agency for science, research and technology;FCT;"BIAL Foundation"",,,,";;;;;;;;;;;;;;;;;;;;;;;;;;;;;;;;;;;;;;;;;;;;;;;;;;;;;;;;;;;;;;;;;;;;;
