index,id,txt,GRNB,FUND,IND,UNI,COR,MISC;;;;;;;;;;;;;;;;;;;;;;;;;;;;;;;;;;;;;;;;;;;;;;;;;;;;;;;;;;;;;;;;;;;;;;;;;;
"437,3972168,""This work is supported by National Natural Science Foundation of China (Grant Nos. 61772550, 61572521, U1636114, 61402531), National Cryptography Development Fund of China Under Grants No. MMJJ20170112, National Key Research and Development Program of China Under Grants No. 2017YFB0802000, Natural Science Basic Research Plan in Shaanxi Province of china (Grant Nos. 2018JM6028) and Guangxi Key Laboratory of Cryptography and Information Security (No. GCIS201610)."",2017YFB0802000";61772550;61572521;MMJJ20170112;GCIS201610;2018JM6028;U1636114;61402531,National Key Research and Development Program of China;National Natural Science Foundation of China;National Cryptography Development Fund of China;Guangxi Key Laboratory of Cryptography and Information Security;Natural Science Basic Research Plan in Shaanxi Province of china,,,,;;;;;;;;;;;;;;;;;;;;;;;;;;;;;;;;;;;;;;;;;;;;;;;;;;;;;;;;;;;;;;;
"438,4014178,""This work is supported in part by JSPS KAKENHI Grant Number JP16J04621, JP16K00305 and JP15H02667, respectively and by JST PRESTO Grant Number JPMJPR16E4."",JP15H02667";JP16K00305;JPMJPR16E4;JP16J04621,JSPS KAKENHI;JST PRESTO,,,,;;;;;;;;;;;;;;;;;;;;;;;;;;;;;;;;;;;;;;;;;;;;;;;;;;;;;;;;;;;;;;;;;;;;;;
"439,4051815,""This work was supported by the National Science and Technology Major Project (2012ZX09301003-002-001, 2011ZXJ09201-031)."",2011ZXJ09201-031";2012ZX09301003-002-001,National Science and Technology Major Project,,,,;;;;;;;;;;;;;;;;;;;;;;;;;;;;;;;;;;;;;;;;;;;;;;;;;;;;;;;;;;;;;;;;;;;;;;;;;
"440,4089567,""This work was supported in part by the National Natural Science Foundation of China under Grants 61472069, 61402089, 61501101, 61502215, and U1401256, in part by the Fundamental Research Foundations for the Central Universities under Grants N161602003, N171607010, N161904001, and N160601001, and in part by the Natural Science Foundation of Liaoning Province under Grant 2015020553."",N161602003";61472069;61402089;61502215;N171607010;U1401256;2015020553;61501101;N161904001;N160601001,Fundamental Research Foundations for the Central Universities;National Natural Science Foundation of China;Natural Science Foundation of Liaoning Province,,,,;;;;;;;;;;;;;;;;;;;;;;;;;;;;;;;;;;;;;;;;;;;;;;;;;;;;;;;;;;;;;;;
441,4095098,This study was funded by the National Science Centre (Grant No. 2011/03/N/HS6/02798).,2011/03/N/HS6/02798,National Science Centre,,,,;;;;;;;;;;;;;;;;;;;;;;;;;;;;;;;;;;;;;;;;;;;;;;;;;;;;;;;;;;;;;;;;;;;;;;;;;;
442,4106835,Contract grant sponsor: National Institute of Mental Health (NIMH); Contract grant number: R01 MH068376.,R01 MH068376,National Institute of Mental Health (NIMH),,,,;;;;;;;;;;;;;;;;;;;;;;;;;;;;;;;;;;;;;;;;;;;;;;;;;;;;;;;;;;;;;;;;;;;;;;;;;
443,4113294,The research has been carried out within work no. S/WM/1/2018 realised at Bialystok University of Technology and financed from the funding allocated for science by the Ministry of Science and Higher Education.,S/WM/1/2018,Ministry of Science and Higher Education,,Bialystok University of Technology,,;;;;;;;;;;;;;;;;;;;;;;;;;;;;;;;;;;;;;;;;;;;;;;;;;;;;;;;;;;;;;;;;;;;;;;;;;;
"444,4134386,""This research was supported by the National Institute of Neurologic Diseases and Stroke (NINDS) and Fogarty International Center (R01NS086312, R25TW009345), National Institute of Allergy and Infectious Diseases (U01AI089244, T32AI055433)."",R01NS086312";T32AI055433;U01AI089244;R25TW009345,Fogarty International Center;National Institute of Allergy and Infectious Diseases;National Institute of Neurologic Diseases and Stroke (NINDS),,,,;;;;;;;;;;;;;;;;;;;;;;;;;;;;;;;;;;;;;;;;;;;;;;;;;;;;;;;;;;;;;;;;;;;;;
"445,4134386,""The authors would like to thank Jose Debes, MD, MS for his assistance in translating our abstract into Spanish."",,,Jose Debes,,,";;;;;;;;;;;;;;;;;;;;;;;;;;;;;;;;;;;;;;;;;;;;;;;;;;;;;;;;;;;;;;;;;;;;;;;;;;
"446,4162856,""This study is part of the Biota-Araca project, funded by FAPESP (2011/50317-5)."",2011/50317-5,FAPESP,,,,";;;;;;;;;;;;;;;;;;;;;;;;;;;;;;;;;;;;;;;;;;;;;;;;;;;;;;;;;;;;;;;;;;;;;;;;;;
447,4162856,The authors are grateful for the CEBIMAR/USP staff and its support of field activities.,,,,CEBIMAR/USP ,,;;;;;;;;;;;;;;;;;;;;;;;;;;;;;;;;;;;;;;;;;;;;;;;;;;;;;;;;;;;;;;;;;;;;;;;;;;
448,4162856,The mooring has been designed and installed by staff from the Oceanographic Instrumentation Lab from the Oceanographic Institute/USP.,,,,Oceanographic Institute/USP,,;;;;;;;;;;;;;;;;;;;;;;;;;;;;;;;;;;;;;;;;;;;;;;;;;;;;;;;;;;;;;;;;;;;;;;;;;;
449,4162856,Eduardo Siegle is a CNPq research fellow.,,CNPq,Eduardo Siegle,,,;;;;;;;;;;;;;;;;;;;;;;;;;;;;;;;;;;;;;;;;;;;;;;;;;;;;;;;;;;;;;;;;;;;;;;;;;;
450,4162856,Barbara C. Villamarin was sponsored by a FAPESP scholarship (2014/00116-1).,2014/00116-1,FAPESP,Barbara C. Villamarin,,,;;;;;;;;;;;;;;;;;;;;;;;;;;;;;;;;;;;;;;;;;;;;;;;;;;;;;;;;;;;;;;;;;;;;;;;;;;
451,4162856,The authors would like to thank the three anonymous reviewers for providing constructive reviews and editors for providing useful comments that improved our manuscript.,,,,,,;;;;;;;;;;;;;;;;;;;;;;;;;;;;;;;;;;;;;;;;;;;;;;;;;;;;;;;;;;;;;;;;;;;;;;;;;;
452,4178577,The work was supported by the Russian Foundation for Basic Research (project no. 18-08-00048).,18-08-00048,Russian Foundation for Basic Research,,,,;;;;;;;;;;;;;;;;;;;;;;;;;;;;;;;;;;;;;;;;;;;;;;;;;;;;;;;;;;;;;;;;;;;;;;;;;;
453,4197397,The authors thank the co-editors and referees for many constructive comments on the previous version of the paper.,,,,,,;;;;;;;;;;;;;;;;;;;;;;;;;;;;;;;;;;;;;;;;;;;;;;;;;;;;;;;;;;;;;;;;;;;;;;;;;;
"454,4197397,""They also thank the participants at the 2016 Tsinghua International Conference on Econometrics in Beijing and the 2nd Dongbei Econometrics Workshop in Dalian, China."",,,,,,""2016 Tsinghua International Conference on Econometrics in Beijing";"2nd Dongbei Econometrics Workshop in Dalian, China""";;;;;;;;;;;;;;;;;;;;;;;;;;;;;;;;;;;;;;;;;;;;;;;;;;;;;;;;;;;;;;;;;;;;;;;;;
455,4197397,Su gratefully acknowledges the Singapore Ministry of Education for Tier-2 Academic Research Fund under Grant Number MOE2012-T2-2-021 and the funding support provided by the Lee Kong Chian Fund for Excellence.,MOE2012-T2-2-021,Singapore Ministry of Education;Tier-2 Academic Research Fund;Lee Kong Chian Fund for Excellence,Su,,,;;;;;;;;;;;;;;;;;;;;;;;;;;;;;;;;;;;;;;;;;;;;;;;;;;;;;;;;;;;;;;;;;;;;;;;;
456,4206120,Project H2020-MSCA-RISE-2014 No. 645691: Researches on the potential conversion of conventional fish farms into organic by establishing a model and good practice guide.,645691,Project H2020-MSCA-RISE-2014,,,,;;;;;;;;;;;;;;;;;;;;;;;;;;;;;;;;;;;;;;;;;;;;;;;;;;;;;;;;;;;;;;;;;;;;;;;;;;
"457,4253838,""We thank the many signers from the communities of Mapuru, Galiwin'ku, Darwin, Pormpuraaw, Ti Tree, Willowra and Tjukurla who have participated in this research on kin signs."",,,,,,";;;;;;;;;;;;;;;;;;;;;;;;;;;;;;;;;;;;;;;;;;;;;;;;;;;;;;;;;;;;;;;;;;;;;;;;;;
"458,4253838,""In particular, thanks go to Janie Long Pwerrerl, Eileen Campbell Pwerrerl, April Campbell Pengart, Norma Giles, Nancy Jackson, Myrtle Foote, Gilbert Jack and Elaine L. Maypilama."",,,Janie Long Pwerrerl";Eileen Campbell Pwerrerl;April Campbell Pengart;Norma Giles;Nancy Jackson;Myrtle Foote;Gilbert Jack;Elaine L. Maypilama,,,;;;;;;;;;;;;;;;;;;;;;;;;;;;;;;;;;;;;;;;;;;;;;;;;;;;;;;;;;;;;;;;;;;;
"459,4253838,""This research has been supported by ARC Postdoctoral Fellowships (DP110102767 and DE160100873) and by the German Research Foundation (DFG) as a part of EuroBABEL project (""""Endangered Sign Languages in Village Communities"""") in 2009-2012."",DP110102767";DE160100873,ARC Postdoctoral Fellowships;EuroBABEL;German Research Foundation (DFG),,,,;;;;;;;;;;;;;;;;;;;;;;;;;;;;;;;;;;;;;;;;;;;;;;;;;;;;;;;;;;;;;;;;;;;;;;;
460,4253838,Research by Elizabeth Marrkilyi Ellis has been supported by ELDP (Endangered Languages Documentation Programme) (SG0187) and an ARC Discovery Indigenous Award (IN150100018).,IN150100018;SG0187,ELDP (Endangered Languages Documentation Programme);ARC Discovery Indigenous Award,,,,;;;;;;;;;;;;;;;;;;;;;;;;;;;;;;;;;;;;;;;;;;;;;;;;;;;;;;;;;;;;;;;;;;;;;;;;
"461,4253838,""Additional support has come from the Research Unit for Indigenous Language at the University of Melbourne (RUIL), and from the ARC Centre of Excellence for the Dynamics of Language (CoEDL)."",,ARC Centre of Excellence for the Dynamics of Language (CoEDL),,University of Melbourne";Research Unit for Indigenous Language,,;;;;;;;;;;;;;;;;;;;;;;;;;;;;;;;;;;;;;;;;;;;;;;;;;;;;;;;;;;;;;;;;;;;;;;;;;
"462,4253838,""We thank Jennifer Taylor for providing the illustrations of signs that appear in this paper, Connie de Vos for encouraging us to pursue this comparative analysis of kin signs, Inge Kral for comments on an earlier version of this paper, and Patrick McConvell and an anonymous reviewer for comments on the final version."",,,Jennifer Taylor";Connie de Vos;Inge Kral;Patrick McConvell,,,;;;;;;;;;;;;;;;;;;;;;;;;;;;;;;;;;;;;;;;;;;;;;;;;;;;;;;;;;;;;;;;;;;;;;;;
463,4253838,Lauren Reed also assisted in the annotation of the Ngaanyatjarra sign corpus.,,,Lauren Reed,,,;;;;;;;;;;;;;;;;;;;;;;;;;;;;;;;;;;;;;;;;;;;;;;;;;;;;;;;;;;;;;;;;;;;;;;;;;;
"464,4253838,""A version of this paper was presented at the Theoretical Issues in Sign Language Research Conference (TISLR) in Melbourne in January 2016, and at the Australian Languages Workshop in Canberra, March 2016."",,,,,,";;;;;;;;;;;;;;;;;;;;;;;;;;;;;;;;;;;;;;;;;;;;;;;;;;;;;;;;;;;;;;;;;;;;;;;;;;
"465,4269971,""This work was supported by Engineering and Physical Sciences Research Council and Wellcome Trust Centre Grants 098461/Z/12/Z (Sleep, Circadian Rhythms & Neuroscience Institute) and 102616/Z (Collaborative Network for Bipolar Research to Improve Outcomes)."",102616/Z";098461/Z/12/Z,Wellcome Trust Centre Grants;Engineering and Physical Sciences Research Council;"Collaborative Network for Bipolar Research to Improve Outcomes,,""Sleep, Circadian Rhythms & Neuroscience Institute";"Wellcome Trust Centre"",,";;;;;;;;;;;;;;;;;;;;;;;;;;;;;;;;;;;;;;;;;;;;;;;;;;;;;;;;;;;;;;;;;;;;;;
466,4269971,NP and OC acknowledge the support of the Research Councils UK Digital Economy Programme grant number EP/G036861/1 (Oxford Centre for Doctoral Training in Healthcare Innovation).,EP/G036861/1,Research Councils UK Digital Economy Programme,,Oxford Centre for Doctoral Training in Healthcare Innovation,,;;;;;;;;;;;;;;;;;;;;;;;;;;;;;;;;;;;;;;;;;;;;;;;;;;;;;;;;;;;;;;;;;;;;;;;;;;
467,4269971,KEAS was supported by the National Institute for Health Research Oxford Health Biomedical Research Centre.,,,,National Institute for Health Research Oxford Health Biomedical Research Centre,,;;;;;;;;;;;;;;;;;;;;;;;;;;;;;;;;;;;;;;;;;;;;;;;;;;;;;;;;;;;;;;;;;;;;;;;;;;
468,4269971,All data underpinning this paper are available via the University of Oxford data repository [34].,,,,University of Oxford,,;;;;;;;;;;;;;;;;;;;;;;;;;;;;;;;;;;;;;;;;;;;;;;;;;;;;;;;;;;;;;;;;;;;;;;;;;;
469,4270385,The following investigation was made thanks to the contributions of the CORFO Project 14ENI2-26905 Ingenieria 2030-PUCV.,14ENI2-26905 Ingenieria 2030-PUCV,CORFO Project,,,,;;;;;;;;;;;;;;;;;;;;;;;;;;;;;;;;;;;;;;;;;;;;;;;;;;;;;;;;;;;;;;;;;;;;;;;;;;
"470,4270385,""In addition, the Collaborative Group of Engineering Education and the School of Civil Engineering of the Pontifical Catholic University of Valparaiso."",,Collaborative Group of Engineering Education,,Pontifical Catholic University of Valparaiso";School of Civil Engineering,,;;;;;;;;;;;;;;;;;;;;;;;;;;;;;;;;;;;;;;;;;;;;;;;;;;;;;;;;;;;;;;;;;;;;;;;;;
471,4270385,The doctoral studies of Professor Herrera are financed with the VRI Grant of the Pontifical Catholic University of Chile.,,,Herrera,Pontifical Catholic University of Chile;VRI,,;;;;;;;;;;;;;;;;;;;;;;;;;;;;;;;;;;;;;;;;;;;;;;;;;;;;;;;;;;;;;;;;;;;;;;;;;
"472,4280594,""This work was supported by the Economic and Social Research Council [grant number ES/J500100/11, an ESRC postgraduate studentship to Chloe Robbins."",ES/J500100/11,Economic and Social Research Council";ESRC,Chloe Robbins,,,;;;;;;;;;;;;;;;;;;;;;;;;;;;;;;;;;;;;;;;;;;;;;;;;;;;;;;;;;;;;;;;;;;;;;;;;;
"473,4317582,""This study was funded by the National Institute on Alcohol Abuse and Alcoholism (5R01AA017592-04";" Organista, PI) and a grant from UC Berkeley's Health Initiative of the Americas Programa de Investigacion en Migracion y Salud (PIMSA) [Migration and Health Research Program] awarded to Samantha Ngo."",5R01AA017592-04,National Institute on Alcohol Abuse and Alcoholism";UC Berkeley;Health Initiative of the Americas Programa de Investigacion en Migracion y Salud (PIMSA),Samantha Ngo,,,Migration and Health Research Program;;;;;;;;;;;;;;;;;;;;;;;;;;;;;;;;;;;;;;;;;;;;;;;;;;;;;;;;;;;;;;;;;;;;;;;
"474,4317582,""The authors would like to thank members of the research team who contributed to the development and oversight of survey implementation: Sonya Arreola, Sahar Khory, James Quesada & Paula Worby."",,,Sonya Arreola";Sahar Khory;James Quesada;Paula Worby,,,;;;;;;;;;;;;;;;;;;;;;;;;;;;;;;;;;;;;;;;;;;;;;;;;;;;;;;;;;;;;;;;;;;;;;;;
475,4355610,Thiago C. Silva (Grant No. 302808/2015-9) and Benjamin M. Tabak (Grant No. 305427/2014-8) gratefully acknowledge financial support from the CNPq foundation.,302808/2015-9;305427/2014-8,CNPq ,Thiago C. Silva;Benjamin M. Tabak,,,;;;;;;;;;;;;;;;;;;;;;;;;;;;;;;;;;;;;;;;;;;;;;;;;;;;;;;;;;;;;;;;;;;;;;;;;
476,4397851,The Dunedin Multidisciplinary Health and Development Research Unit is supported by the New Zealand Health Research Council.,,,,,,;;;;;;;;;;;;;;;;;;;;;;;;;;;;;;;;;;;;;;;;;;;;;;;;;;;;;;;;;;;;;;;;;;;;;;;;;;
"477,4397851,""This work was supported by the National Institute on Aging (AG032282, AG048895), the Medical Research Council (MR/K00381X), the Economic and Social Research Council (ES/M010309/1), and the Jacobs Foundation."",ES/M010309/1";AG048895;AG032282;MR/K00381X,Economic and Social Research Council;National Institute on Aging;Medical Research Council;Jacobs Foundation,,,,;;;;;;;;;;;;;;;;;;;;;;;;;;;;;;;;;;;;;;;;;;;;;;;;;;;;;;;;;;;;;;;;;;;;
"478,4397851,""J. D. S. and D. W. B. were supported by the NIA (T32-AG000139-25, T-32AG000029), and (P30-AG028716-08)."",T-32AG000029";T32-AG000139-25;P30-AG028716-08,NIA,J. D. S.;W. B.,,,;;;;;;;;;;;;;;;;;;;;;;;;;;;;;;;;;;;;;;;;;;;;;;;;;;;;;;;;;;;;;;;;;;;;;;;
"479,4430746,""This work was supported by grant STPD11B8HM from the University of Padova to R. D.' A., and by a discovery grant from NSERC, the Canada Foundation for Innovation, and the Canada Research Chair program awarded to P. J. P."",STPD11B8HM,Canada Foundation for Innovation";NSERC;Canada Research Chair,,University of Padova,,;;;;;;;;;;;;;;;;;;;;;;;;;;;;;;;;;;;;;;;;;;;;;;;;;;;;;;;;;;;;;;;;;;;;;;;;
480,4430746,E. D. was supported by an Australian Research Council Future Fellowship (FT120100033).,FT120100033,Australian Research Council Future Fellowship,,,,;;;;;;;;;;;;;;;;;;;;;;;;;;;;;;;;;;;;;;;;;;;;;;;;;;;;;;;;;;;;;;;;;;;;;;;;;;
481,4430746,B. W. was supported by NSF grant BCS-1331073.,BCS-1331073,NSF,B. W.,,,;;;;;;;;;;;;;;;;;;;;;;;;;;;;;;;;;;;;;;;;;;;;;;;;;;;;;;;;;;;;;;;;;;;;;;;;;;
482,4437139,This project was funded by the National Institute for Health Research Service Delivery and Organisation (NIHR SDO) programme (project number 08/1803/226).,08/1803/226,National Institute for Health Research Service Delivery and Organisation (NIHR SDO),,,,;;;;;;;;;;;;;;;;;;;;;;;;;;;;;;;;;;;;;;;;;;;;;;;;;;;;;;;;;;;;;;;;;;;;;;;;;;
483,4437139,Visit the SDO programme website for more information.,,,,,,;;;;;;;;;;;;;;;;;;;;;;;;;;;;;;;;;;;;;;;;;;;;;;;;;;;;;;;;;;;;;;;;;;;;;;;;;;
"484,4454522,""This work has been supported with the grant of the National Science Centre, Poland 2015/17/B/ST8/03251."",2015/17/B/ST8/03251,""National Science Centre, Poland"",,,,";;;;;;;;;;;;;;;;;;;;;;;;;;;;;;;;;;;;;;;;;;;;;;;;;;;;;;;;;;;;;;;;;;;;;;;;;;
485,4458679,The authors thank Hanneke den Ouden for generating the time-varying contingencies and Melissa Aguilar for data collection in Experiment 1.,,,Hanneke den Ouden;Melissa Aguilar,,,;;;;;;;;;;;;;;;;;;;;;;;;;;;;;;;;;;;;;;;;;;;;;;;;;;;;;;;;;;;;;;;;;;;;;;;;;
486,4458679,Funding was gratefully received from NIDA grant DA 026452 (to A. R. A.).,DA 026452,NIDA,A. R. A.,,,;;;;;;;;;;;;;;;;;;;;;;;;;;;;;;;;;;;;;;;;;;;;;;;;;;;;;;;;;;;;;;;;;;;;;;;;;;
487,4522934,The authors would like to thank the editors and the anonymous reviewers for their valuable comments and suggestions which have helped immensely in improving the quality of the paper.,,,,,,;;;;;;;;;;;;;;;;;;;;;;;;;;;;;;;;;;;;;;;;;;;;;;;;;;;;;;;;;;;;;;;;;;;;;;;;;;
"488,4522934,""This work is supported by National Natural Science Foundation of China (11461005), Natural Science Foundation of Guangxi Province (2016GXNSFAA380045, 2016GXNSFAA380282, 2016GXNSFAA380286), Undergraduate Teaching Reform Project of Guangxi (2017JGA179), Key Laboratory of Optimization Control and Engineering Calculation in Department of Guangxi Education and Special Funds of Guangxi Distinguished Experts Construction Engineering."",2016GXNSFAA380045";2016GXNSFAA380286;2016GXNSFAA380282;11461005;2017JGA179,Natural Science Foundation of Guangxi Province;National Natural Science Foundation of China;Undergraduate Teaching Reform Project of Guangxi;Key Laboratory of Optimization Control and Engineering Calculation in Department of Guangxi Education;Guangxi Distinguished Experts Construction Engineering.,,,,;;;;;;;;;;;;;;;;;;;;;;;;;;;;;;;;;;;;;;;;;;;;;;;;;;;;;;;;;;;;;;;;;;
489,4560184,This work was supported by the National Natural Science Foundation of China (Grant No. 51509033) and the Fundamental Research Funds for the Central Universities (Grant No. DUT16QY15).,51509033;DUT16QY15,National Natural Science Foundation of China;Fundamental Research Funds for the Central Universities,,,,;;;;;;;;;;;;;;;;;;;;;;;;;;;;;;;;;;;;;;;;;;;;;;;;;;;;;;;;;;;;;;;;;;;;;;;;
"490,4599888,""This work was supported by KAKENHI from the Japan Society for the Promotion of Science (JSPS), Grant-in-Aid for JSPS Fellows, Japan [No. 17J02784], and Grant-in-Aid for JSPS Overseas Challenge Program for Young Researchers, Japan [No. 201780162]."",17J02784";"201780162,""KAKENHI from the Japan Society for the Promotion of Science (JSPS)";JSPS Fellows, Japan;"JSPS Overseas Challenge Program for Young Researchers, Japan"",,,,";;;;;;;;;;;;;;;;;;;;;;;;;;;;;;;;;;;;;;;;;;;;;;;;;;;;;;;;;;;;;;;;;;;;;;;
491,4599888,The last two grants are related to an ERC project ACCORD (GA639945).,GA639945,ERC project ACCORD,,,,;;;;;;;;;;;;;;;;;;;;;;;;;;;;;;;;;;;;;;;;;;;;;;;;;;;;;;;;;;;;;;;;;;;;;;;;;;
"492,4599888,""I would like to express my gratitude to Waseda University, Japan for their financial support."",,,,""Waseda University, Japan"",,";;;;;;;;;;;;;;;;;;;;;;;;;;;;;;;;;;;;;;;;;;;;;;;;;;;;;;;;;;;;;;;;;;;;;;;;;;
493,4599888,I am grateful to Koichi Suga and Edith Elkind for their excellent and helpful comments and suggestions.,,,Koichi Suga;Edith Elkind,,,;;;;;;;;;;;;;;;;;;;;;;;;;;;;;;;;;;;;;;;;;;;;;;;;;;;;;;;;;;;;;;;;;;;;;;;;;
"494,4604235,""Supported by DFG grants LE 3382/2-1 and SA 465/50-1, and the DAAD STIBET Matching Funds grant."",LE 3382/2-1";SA 465/50-1,DFG,,,,;;;;;;;;;;;;;;;;;;;;;;;;;;;;;;;;;;;;;;;;;;;;;;;;;;;;;;;;;;;;;;;;;;;;;;;;;
495,4604611,This work has been funded by the European Union's Seventh Framework Programme (FP7/2007-2013) under Grant agreement ACP2-GA-2012-314562-QUICOM.,ACP2-GA-2012-314562-QUICOM,European Union's Seventh Framework Programme (FP7/2007-2013),,,,;;;;;;;;;;;;;;;;;;;;;;;;;;;;;;;;;;;;;;;;;;;;;;;;;;;;;;;;;;;;;;;;;;;;;;;;;;
496,4604611,Furthermore we thank Michael Schobel for providing the AlSiC datasets.,,,Michael Schobel,,,;;;;;;;;;;;;;;;;;;;;;;;;;;;;;;;;;;;;;;;;;;;;;;;;;;;;;;;;;;;;;;;;;;;;;;;;;;
497,4609851,Our work is partly supported by JSPS KAKENHI Scientific Research(S) - Number 15H05711.,15H05711,JSPS KAKENHI Scientific Research(S),,,,;;;;;;;;;;;;;;;;;;;;;;;;;;;;;;;;;;;;;;;;;;;;;;;;;;;;;;;;;;;;;;;;;;;;;;;;;;
"498,4633918,""This work was supported in part by the National Natural Science Foundation of China under Grant 11461020 and Grant 11601006, in part by the Anhui Province Key Laboratory of Intelligent Building and Building Energy Saving, in part by the Research Foundation of the Higher Education Institutions of Gansu Province, China, under Grant 2018A-093, and in part by the Science and Technology Plan of Gansu Province under Grant 18JR3RG206."",2018A-093";18JR3RG206;11461020;"11601006,""Research Foundation of the Higher Education Institutions of Gansu Province, China";Science and Technology Plan of Gansu Province;National Natural Science Foundation of China;Anhui Province Key Laboratory of Intelligent Building and Building Energy Saving;",,,,
499,4641040,The authors gratefully acknowledge the help of colleagues from partner institutions who helped advise and shape this research.,,,,,,
500,4641040,This material is based in part upon work supported by the National Science Foundation under Grant Number DUE-0717820.,DUE-0717820,National Science Foundation,,,,
501,4641040,Any opinions, findings, and conclusions or recommendations expressed in this material are those of the author(s) and do not necessarily reflect the views of the National Science Foundation."",,National Science Foundation,,,,";;;;;;;;;;;;;;;;;;;;;;;;;;;;;;;;;;;;;;;;;;;;;;;;;;;;;;;;;;;;;;;;;;;
"502,4641705,""This work was partly funded by FAPERJ, CAPES, CNPq, and grants 15/24494-8 and 15/24490-2, Sao Paulo Research Foundation (FAPESP)."",15/24494-8";15/24490-2,Sao Paulo Research Foundation (FAPESP);FAPERJ;CAPES;CNPq,,,,;;;;;;;;;;;;;;;;;;;;;;;;;;;;;;;;;;;;;;;;;;;;;;;;;;;;;;;;;;;;;;;;;;;;;;
"503,4657179,""This work was made possible in part by grants from the German Research Foundation to S. Heim and A. Keil and from the National Institute of Mental Health (R01 MH097320) to A. Keil, with additional support from the CKEW Foundation to S. Heim."",R01 MH097320,National Institute of Mental Health";German Research Foundation;CKEW Foundation,S. Heim;A. Keil,,,;;;;;;;;;;;;;;;;;;;;;;;;;;;;;;;;;;;;;;;;;;;;;;;;;;;;;;;;;;;;;;;;;;;;;;;
"504,4657179,""We give special thanks to the students who volunteered their time to participate in the present study, as well as to the parents for their commitment."",,,,,,";;;;;;;;;;;;;;;;;;;;;;;;;;;;;;;;;;;;;;;;;;;;;;;;;;;;;;;;;;;;;;;;;;;;;;;;;;
"505,4674189,""This study was supported by the National Natural Science Foundation of China (Grant No. 51279187), the Science and Technology Major Project of Shandong Province (Grant No. 2015ZDZX04003), and the Key Research and Development Program of Shandong Province (Grant No. 2018GHY115045)."",51279187";2018GHY115045;2015ZDZX04003,National Natural Science Foundation of China;Key Research and Development Program of Shandong Province;Science and Technology Major Project of Shandong Province,,,,;;;;;;;;;;;;;;;;;;;;;;;;;;;;;;;;;;;;;;;;;;;;;;;;;;;;;;;;;;;;;;;;;;;;;;
506,4682908,This work was partially funded by the European Commission under the Erasmus Mundus E-GOV-TN project (Open Government data in Tunisia for service innovation and transparency) - EMA2; Grant Agreement no. 2013-2434/001-001 and by the Polish National Center for Research and Development under the project PBS2/B3/24/2014.,PBS2/B3/24/2014;EMA2;2013-2434/001-001,Polish National Center for Research and Development;European Commission under the Erasmus Mundus E-GOV-TN,,,,;;;;;;;;;;;;;;;;;;;;;;;;;;;;;;;;;;;;;;;;;;;;;;;;;;;;;;;;;;;;;;;;;;;;;;
"507,4720072,""Supported by AA-08315, AA-12502, and AA-00145 from National Institutes of Health, by 100499, 205585, 118555, 141054, 265240, 263278, 264146, 259764 from Academy of Finland and by the Finnish Medical Foundation, the Yrjo Jahnsson Foundation, and the Medical Society of Finland (Finska Lakaresallskapet)."",118555";264146;100499;AA-00145;263278;AA-08315;259764;141054;AA-12502;265240;205585,National Institutes of Health;Finnish Medical Foundation;Yrjo Jahnsson Foundation;Medical Society of Finland (Finska Lakaresallskapet),,Academy of Finland,,;;;;;;;;;;;;;;;;;;;;;;;;;;;;;;;;;;;;;;;;;;;;;;;;;;;;;;;;;;;;;
"508,4805054,""Funding for this project was provided by the US Department of Defense, Office of Naval Research, through the Minerva Initiative no. N00014-14-1-0050."",N00014-14-1-0050,""US Department of Defense, Office of Naval Research, through the Minerva Initiative"",,,,";;;;;;;;;;;;;;;;;;;;;;;;;;;;;;;;;;;;;;;;;;;;;;;;;;;;;;;;;;;;;;;;;;;;;;;;;;
"509,4813483,""This work is supported by the National Natural Science Foundation of China (Grant No. 51709229,11502210 and 51479170), the National Key Research and Development Project of China (Grant No. 2016YFC0301300)."",51709229";2016YFC0301300;11502210;51479170,National Natural Science Foundation of China;National Key Research and Development Project of China,,,,;;;;;;;;;;;;;;;;;;;;;;;;;;;;;;;;;;;;;;;;;;;;;;;;;;;;;;;;;;;;;;;;;;;;;;
"510,4813483,""Our work is also supported by Natural Science Basic Research Plan in Shaanxi Province of China (Grant No. 2018JQ5092), and we are grateful for that."",2018JQ5092,Natural Science Basic Research Plan in Shaanxi Province of China,,,,";;;;;;;;;;;;;;;;;;;;;;;;;;;;;;;;;;;;;;;;;;;;;;;;;;;;;;;;;;;;;;;;;;;;;;;;;;
511,4834187,This study was supported by a grant from the Economic and Social Research Council (ES/L0008211/1 to L.G.).,ES/L0008211/1,Economic and Social Research Council,,,,;;;;;;;;;;;;;;;;;;;;;;;;;;;;;;;;;;;;;;;;;;;;;;;;;;;;;;;;;;;;;;;;;;;;;;;;;;
512,4834187,The findings and conclusions in this report are those of the authors and do not represent the views of the sponsors.,,,,,,;;;;;;;;;;;;;;;;;;;;;;;;;;;;;;;;;;;;;;;;;;;;;;;;;;;;;;;;;;;;;;;;;;;;;;;;;;
