index,id,txt,GRNB,FUND,IND,UNI,COR,MISC;;;;;;;;;;;;;;;;;;;;;;;;;;;;;;;;;;;;;;;;;;;;;;;;;;;;;;;;;;;;;;;;;;;;;;;;;;
1477,13650982,We also thank the two anonymous reviewers for their constructive and insightful comments that helped improve the quality of this paper.,,,,,,;;;;;;;;;;;;;;;;;;;;;;;;;;;;;;;;;;;;;;;;;;;;;;;;;;;;;;;;;;;;;;;;;;;;;;;;;;
1478,13650982,This work was supported by the Major Projects of the National Social Science Foundation of China [17ZDA221] and Social Sciences and Humanities Research Council of Canada Standard and Partnership Development Grants (Yang).,17ZDA221,Major Projects of the National Social Science Foundation of China;Social Sciences and Humanities Research Council of Canada Standard and Partnership Development Grants,,,,;;;;;;;;;;;;;;;;;;;;;;;;;;;;;;;;;;;;;;;;;;;;;;;;;;;;;;;;;;;;;;;;;;;;;;;;;
1479,13704926,We are grateful for helpful comments from two anonymous reviewers.,,,,,,;;;;;;;;;;;;;;;;;;;;;;;;;;;;;;;;;;;;;;;;;;;;;;;;;;;;;;;;;;;;;;;;;;;;;;;;;;
"1480,13704926,""We acknowledge financial aid from the Spanish Ministry of Economy, Industry and Competitiveness and FEDER (projects ECO2017-85451-R and ECO2014-53904-R) and from Universidad de La Rioja (ATUR17/34, ATUR 16/25 and ATUR15/25)."",ECO2017-85451-R";ATUR15/25;ATUR17/34;ECO2014-53904-R;"ATUR 16/25,""FEDER";"Spanish Ministry of Economy, Industry and Competitiveness"",,Universidad de La Rioja,,";;;;;;;;;;;;;;;;;;;;;;;;;;;;;;;;;;;;;;;;;;;;;;;;;;;;;;;;;;;;;;;;;;;;;
1481,13718279,This work was partly supported by a JSPS KAKENHI Grant-in-Aid for Scientific Research (A) 16H01723.,16H01723,JSPS KAKENHI,,,,;;;;;;;;;;;;;;;;;;;;;;;;;;;;;;;;;;;;;;;;;;;;;;;;;;;;;;;;;;;;;;;;;;;;;;;;;;
1482,13722026,The research presented in this article was supported by the UK's Economic and Social Research Council (ESRC grant number: ES/J007927/1).,ES/J007927/1,UK's Economic and Social Research Council;ESRC,,,,;;;;;;;;;;;;;;;;;;;;;;;;;;;;;;;;;;;;;;;;;;;;;;;;;;;;;;;;;;;;;;;;;;;;;;;;;
1483,13722026,Information about the dataset analysed in the article can be found here: http://www.research.lancs.ac.uk/portal/en/datasets/metaphor-in-endoflife-care-corpus-dataset(f5908ca7-8e6e-486e-9292-d4968891f6be).html,,,,,,;;;;;;;;;;;;;;;;;;;;;;;;;;;;;;;;;;;;;;;;;;;;;;;;;;;;;;;;;;;;;;;;;;;;;;;;;;
1484,13742700,Research reported in this publication was supported by the National Cancer Institute of the National Institutes of Health under Award Number P50CA180890.,P50CA180890,National Cancer Institute of the National Institutes of Health,,,,;;;;;;;;;;;;;;;;;;;;;;;;;;;;;;;;;;;;;;;;;;;;;;;;;;;;;;;;;;;;;;;;;;;;;;;;;;
1485,13742700,The content is solely the responsibility of the authors and does not necessarily represent the official views of the National Institutes of Health.,,,,,,;;;;;;;;;;;;;;;;;;;;;;;;;;;;;;;;;;;;;;;;;;;;;;;;;;;;;;;;;;;;;;;;;;;;;;;;;;
"1486,13778556,""We are grateful to the captain and crew of the R/V """"Dong Fang Hong 2"""" for help and cooperation during the cruise."",,,,,,""R/V """"Dong Fang Hong 2""""""";;;;;;;;;;;;;;;;;;;;;;;;;;;;;;;;;;;;;;;;;;;;;;;;;;;;;;;;;;;;;;;;;;;;;;;;;;
"1487,13778556,""This work was financially supported by the National Key Research and Development Program of China (Grant No. 2016YFA0601301), the National Natural Science Foundation of China (Grant Nos. 41576073 and 41320104008), the National Natural Science Foundation for Creative Research Groups (Grant No. 41521064), and Aoshan Talents Program of Qingdao National Laboratory for Marine Science and Technology (Grant No. 2015 ASTP)."",41576073";2016YFA0601301;2015 ASTP;41521064;41320104008,National Natural Science Foundation of China;National Key Research and Development Program of China;Aoshan Talents Program of Qingdao National Laboratory for Marine Science and Technology;National Natural Science Foundation for Creative Research Groups,,,,;;;;;;;;;;;;;;;;;;;;;;;;;;;;;;;;;;;;;;;;;;;;;;;;;;;;;;;;;;;;;;;;;;;
"1488,13792918,""The work of KR, DN, and FvdV was funded by the project ConCreTe."",,ConCreTe,,,,";;;;;;;;;;;;;;;;;;;;;;;;;;;;;;;;;;;;;;;;;;;;;;;;;;;;;;;;;;;;;;;;;;;;;;;;;;
"1489,13792918,""The project ConCreTe acknowledges the financial support of the Future and Emerging Technologies (FET) programme within the Seventh Framework Programme for Research of the European Commission, under H2020 Future and Emerging Technologies grant number 611733."",611733,Future and Emerging Technologies (FET)";Seventh Framework Programme for Research of the European Commission;H2020 Future and Emerging Technologies grant,,,,ConCreTe;;;;;;;;;;;;;;;;;;;;;;;;;;;;;;;;;;;;;;;;;;;;;;;;;;;;;;;;;;;;;;;;;;;;;;;;
"1490,13798379,""This research was supported by the National Natural Science Foundation of China (NSFC, 71271220)"",71271220,National Natural Science Foundation of China";NSFC,,,,;;;;;;;;;;;;;;;;;;;;;;;;;;;;;;;;;;;;;;;;;;;;;;;;;;;;;;;;;;;;;;;;;;;;;;;;;
1491,13818347,The author would like to thank lab member Wenfeng Zhao for preparing the low-voltage digital synthesis library.,,,Wenfeng Zhao,,,;;;;;;;;;;;;;;;;;;;;;;;;;;;;;;;;;;;;;;;;;;;;;;;;;;;;;;;;;;;;;;;;;;;;;;;;;;
"1492,13818347,""This work is supported by Singapore A*STAR and MOE grants R-263-000-699-305, R-263-000-A32-305, R-263-000-A29-133, and R-263-000-619-133."",R-263-000-A32-305";R-263-000-619-133;R-263-000-699-305;R-263-000-A29-133,MOE;Singapore A*STAR,,,,;;;;;;;;;;;;;;;;;;;;;;;;;;;;;;;;;;;;;;;;;;;;;;;;;;;;;;;;;;;;;;;;;;;;;;
"1493,13834978,""National Science Funding of Guangdong Province, Grant/Award number: 2016A030313659"; Science Research Project of Guangdong Province, Grant/Award number: 2017A020220011; Shenzhen Technical Project, Grant/Award number: JCYJ20170307151733005;" National Natural Science Foundation of China (NSFC), Grant/Award number: 61503092"",JCYJ20170307151733005";2016A030313659;2017A020220011;61503092,Shenzhen Technical Project;National Science Funding of Guangdong Province;Science Research Project of Guangdong Province;National Natural Science Foundation of China (NSFC),,,,;;;;;;;;;;;;;;;;;;;;;;;;;;;;;;;;;;;;;;;;;;;;;;;;;;;;;;;;;;;;;;;;;
1494,13840741,This research is part of a Teaching Innovation Project (PID27_201416) funded by the University of Jaen (Spain).,PID27_201416,Teaching Innovation Project,,University of Jaen (Spain),,;;;;;;;;;;;;;;;;;;;;;;;;;;;;;;;;;;;;;;;;;;;;;;;;;;;;;;;;;;;;;;;;;;;;;;;;;;
1495,13873897,This research was supported by the Technion-Israel Institute of Technology and by the I-CORE Program of the Planning and Budgeting Committee and The Israel Science Foundation grant 1716/12.,1716/12,Israel Science Foundation;I-CORE Program of the Planning and Budgeting Committee,,Technion-Israel Institute of Technology,,;;;;;;;;;;;;;;;;;;;;;;;;;;;;;;;;;;;;;;;;;;;;;;;;;;;;;;;;;;;;;;;;;;;;;;;;;
"1496,13913265,""This work was supported by the National Natural Science Foundation of China (Nos. 61860206010, U1736219, 61571327, and 61703302)."",61703302";61860206010;61571327;U1736219,National Natural Science Foundation of China,,,,;;;;;;;;;;;;;;;;;;;;;;;;;;;;;;;;;;;;;;;;;;;;;;;;;;;;;;;;;;;;;;;;;;;;;;;
"1497,13918591,""This report was prepared by Oregon Sea Grant under award no. NA14OAR4170064, project no. R/RCF-36 from the National Oceanic and Atmospheric Administration U.S. Department of Commerce, and by appropriations made by the Oregon State Legislature."",R/RCF-36";NA14OAR4170064,National Oceanic and Atmospheric Administration U.S. Department of Commerce,,,,Oregon Sea Grant;Oregon State Legislature;;;;;;;;;;;;;;;;;;;;;;;;;;;;;;;;;;;;;;;;;;;;;;;;;;;;;;;;;;;;;;;;;;;;;;;;
"1498,13918591,""The statements, findings, conclusions, and recommendations are those of the authors and do not necessarily reflect the views of these funders."",,,,,,";;;;;;;;;;;;;;;;;;;;;;;;;;;;;;;;;;;;;;;;;;;;;;;;;;;;;;;;;;;;;;;;;;;;;;;;;;
1499,13918591,The authors are gratefulto two anonymous reviewers whose comments helped to improve the quality of the manuscript.,,,,,,;;;;;;;;;;;;;;;;;;;;;;;;;;;;;;;;;;;;;;;;;;;;;;;;;;;;;;;;;;;;;;;;;;;;;;;;;;
1500,13918591,The authors also thank the coastal fishing families and community leaders for their cooperation and support by participating in this project.,,,,,,;;;;;;;;;;;;;;;;;;;;;;;;;;;;;;;;;;;;;;;;;;;;;;;;;;;;;;;;;;;;;;;;;;;;;;;;;;
"1501,13922939,""This work was supported by JST CREST Grant Number JPMJCR14D5, Japan."",JPMJCR14D5,JST CREST,,,,";;;;;;;;;;;;;;;;;;;;;;;;;;;;;;;;;;;;;;;;;;;;;;;;;;;;;;;;;;;;;;;;;;;;;;;;;;
1502,13924875,This study is supported by National Natural Science Foundation of China under Grant No. 70871030.,70871030,National Natural Science Foundation of China,,,,;;;;;;;;;;;;;;;;;;;;;;;;;;;;;;;;;;;;;;;;;;;;;;;;;;;;;;;;;;;;;;;;;;;;;;;;;;
"1503,13941929,""This publication was supported by the National Center for Advancing Translational Sciences, National Institutes of Health, through Duke-CTSA Grant Number 5TL1TR001116-03."",5TL1TR001116-03,National Center for Advancing Translational Sciences";National Institutes of Health;Duke-CTSA Grant,,,,;;;;;;;;;;;;;;;;;;;;;;;;;;;;;;;;;;;;;;;;;;;;;;;;;;;;;;;;;;;;;;;;;;;;;;;;
1504,13941929,Its contents are solely the responsibility of the authors and do not necessarily represent the official views of the NIH.,,,,,,;;;;;;;;;;;;;;;;;;;;;;;;;;;;;;;;;;;;;;;;;;;;;;;;;;;;;;;;;;;;;;;;;;;;;;;;;;
"1505,13950032,""The 1994 Chengdu study was supported by a grant from the China Medical Board in New York (CMB, 92-557";" M. Z. Xiang, PI)."",92-557,China Medical Board in New York,M. Z. Xiang,,,1994 Chengdu";;;;;;;;;;;;;;;;;;;;;;;;;;;;;;;;;;;;;;;;;;;;;;;;;;;;;;;;;;;;;;;;;;;;;;;;;
"1506,13950032,""This study was supported in part by GRIP 1 R01 TW007260-01 (M. S. Ran, PI) from the Fogarty International Center of NIH and American Foundation for Suicide Prevention (AFSP) (M. S. Ran, PI)."",1 R01 TW007260-01,American Foundation for Suicide Prevention (AFSP)";GRIP;Fogarty International Center of NIH,M. S. Ran,,,;;;;;;;;;;;;;;;;;;;;;;;;;;;;;;;;;;;;;;;;;;;;;;;;;;;;;;;;;;;;;;;;;;;;;;;;
"1507,13950032,""We thank all the patient participants, and the staff of the Xinjin Mental Hospital and Chengdu Mental Health Center for cooperation and data collection."",,Chengdu Mental Health Center";Xinjin Mental Hospital,,,,;;;;;;;;;;;;;;;;;;;;;;;;;;;;;;;;;;;;;;;;;;;;;;;;;;;;;;;;;;;;;;;;;;;;;;;;;
"1508,13952433,""This research was partially done whilst the authors were visiting fellows at the Isaac Newton Institute for Mathematical Sciences in the programme Mathematical, Foundational and Computational Aspects of the Higher Infinite."",,,,Isaac Newton Institute for Mathematical Sciences,,""Mathematical, Foundational and Computational Aspects of the Higher Infinite""";;;;;;;;;;;;;;;;;;;;;;;;;;;;;;;;;;;;;;;;;;;;;;;;;;;;;;;;;;;;;;;;;;;;;;;;;;
1509,13952433,The research benefited from the Royal Society International Exchange Grant Infinite games in logic and Weihrauch degrees.,,Royal Society International Exchange Grant Infinite games in logic and Weihrauch degrees,,,,;;;;;;;;;;;;;;;;;;;;;;;;;;;;;;;;;;;;;;;;;;;;;;;;;;;;;;;;;;;;;;;;;;;;;;;;;;
1510,13952433,The second author was also supported by the Capes Science Without Borders grant number 9625/13-5.,9625/13-5,Capes Science Without Borders,,,,;;;;;;;;;;;;;;;;;;;;;;;;;;;;;;;;;;;;;;;;;;;;;;;;;;;;;;;;;;;;;;;;;;;;;;;;;;
"1511,13952433,""The authors are grateful to Benedikt Lowe and Arno Pauly for the many fruitful discussions and to the Institute for Logic, Language and Computation for the hospitality offered to the first author."",,,Benedikt Lowe";"Arno Pauly,""Institute for Logic, Language and Computation"",,";;;;;;;;;;;;;;;;;;;;;;;;;;;;;;;;;;;;;;;;;;;;;;;;;;;;;;;;;;;;;;;;;;;;;;;;;
"1512,13952433,""Finally, the authors wish to thank the three anonymous referees for the helpful comments which have improved the paper."",,,,,,";;;;;;;;;;;;;;;;;;;;;;;;;;;;;;;;;;;;;;;;;;;;;;;;;;;;;;;;;;;;;;;;;;;;;;;;;;
"1513,13953548,""This work was partially funded by the Consejo Nacional de Ciencia y Tecnologia (CONACYT-221499 and 103983) and the Programa de Mejoramiento al Profesorado (PROMEP, UANL-CA-306)."",CONACYT-221499";UANL-CA-306;103983,Consejo Nacional de Ciencia y Tecnologia;Programa de Mejoramiento al Profesorado,,,,;;;;;;;;;;;;;;;;;;;;;;;;;;;;;;;;;;;;;;;;;;;;;;;;;;;;;;;;;;;;;;;;;;;;;;;
"1514,13958267,""The authors gratefully thank the Co-editor Jianqing Fan, the Associate Editor, and two anonymous referees for their many constructive comments on the previous version of the paper."",,,Jianqing Fan,,,";;;;;;;;;;;;;;;;;;;;;;;;;;;;;;;;;;;;;;;;;;;;;;;;;;;;;;;;;;;;;;;;;;;;;;;;;;
1515,13958267,Ma's research was partially supported by NSF grants DMS 1306972 and DMS 1712558 and Hellman Fellowship.,DMS 1712558;DMS 1306972,NSF;Hellman Fellowship,,,,;;;;;;;;;;;;;;;;;;;;;;;;;;;;;;;;;;;;;;;;;;;;;;;;;;;;;;;;;;;;;;;;;;;;;;;;
1516,13958267,Su gratefully acknowledges the Singapore Ministry of Education for the Tier-2 Academic Research Fund (AcRF) under grant number MOE2012-T2-2-021 and the Lee Kong Chian Fund for Excellence.,MOE2012-T2-2-021,Singapore Ministry of Education;Tier-2 Academic Research Fund (AcRF);Lee Kong Chian Fund for Excellence,Su,,,;;;;;;;;;;;;;;;;;;;;;;;;;;;;;;;;;;;;;;;;;;;;;;;;;;;;;;;;;;;;;;;;;;;;;;;;
"1517,13983322,""UNIAG, R&D unit funded by the FCT - Portuguese Foundation for the Development of Science and Technology, Ministry of Science, Technology and Higher Education."",,""FCT - Portuguese Foundation for the Development of Science and Technology, Ministry of Science, Technology and Higher Education"",,,,""UNIAG, R&D""";;;;;;;;;;;;;;;;;;;;;;;;;;;;;;;;;;;;;;;;;;;;;;;;;;;;;;;;;;;;;;;;;;;;;;;;;;
1518,13983322,UID/GES/4752/2016,UID/GES/4752/2016,,,,,;;;;;;;;;;;;;;;;;;;;;;;;;;;;;;;;;;;;;;;;;;;;;;;;;;;;;;;;;;;;;;;;;;;;;;;;;;
"1519,14050912,""This research was partially supported by University Tun Hussein Onn Malaysia, Johor using Short Term Grant (U646)."",U646,,,""University Tun Hussein Onn Malaysia, Johor"",,";;;;;;;;;;;;;;;;;;;;;;;;;;;;;;;;;;;;;;;;;;;;;;;;;;;;;;;;;;;;;;;;;;;;;;;;;;
1520,14050912,We thank our colleagues from University Sains Malaysia who provided insight and expertise that greatly assisted the research.,,,,University Sains Malaysia,,;;;;;;;;;;;;;;;;;;;;;;;;;;;;;;;;;;;;;;;;;;;;;;;;;;;;;;;;;;;;;;;;;;;;;;;;;;
"1521,14051539,""The author(s) disclosed receipt of the following financial support for the research, authorship, and/or publication of this article: This research was supported by a U.S. Department of Health and Human Services Fellowship for Doctoral Candidates and Faculty for Research in Child Maltreatment."",,U.S. Department of Health and Human Services Fellowship for Doctoral Candidates,,Faculty for Research in Child Maltreatment,,";;;;;;;;;;;;;;;;;;;;;;;;;;;;;;;;;;;;;;;;;;;;;;;;;;;;;;;;;;;;;;;;;;;;;;;;;;
"1522,14051539,""This work was also supported by a postdoctoral fellowship provided by the National Institute of Child Health and Human Development (T32-HD07376) through the Center for Developmental Science, University of North Carolina at Chapel Hill, to H. M. Milojevich."",T32-HD07376,National Institute of Child Health and Human Development,M. Milojevich,Center for Developmental Science";University of North Carolina at Chapel Hill,,;;;;;;;;;;;;;;;;;;;;;;;;;;;;;;;;;;;;;;;;;;;;;;;;;;;;;;;;;;;;;;;;;;;;;;;;;
"1523,14086578,""This work was supported by the Economic and Social Research Council [PTA-030-2004-00008], United Nations International Research and Training Institute for the Advancement of Women, United Nations Development Programme and the Leverhulme Trust [20080907]."",20080907";PTA-030-2004-00008,Leverhulme Trust;Economic and Social Research Council;United Nations Development Programme,,United Nations International Research and Training Institute for the Advancement of Women,,;;;;;;;;;;;;;;;;;;;;;;;;;;;;;;;;;;;;;;;;;;;;;;;;;;;;;;;;;;;;;;;;;;;;;;;
"1524,14153063,""The first and the fourth author thank the Department of Science and Technology, India for INSPIRE Fellowship (Grant No: DST/INSPIRE Fellowship/2013/963) and Fund for Improvement of S&T Infrastructure in Universities and Higher Educational Institutions (SR/FST/ ETI-349/2013) for their financial support"; The second author thanks the Tata Consultancy Services for their financial support;" The third author thanks the Department of Science and Technology - Fund for Improvement of S&T Infrastructure in Universities and Higher Educational Institutions Government of India (SR/FST/MSI-107/2015) for their financial support."",DST/INSPIRE Fellowship/2013/963";SR/FST/ ETI-349/2013;"SR/FST/MSI-107/2015,""Department of Science and Technology, India";INSPIRE Fellowship;Fund for Improvement of S&T Infrastructure in Universities and Higher Educational Institutions;"Department of Science and Technology - Fund for Improvement of S&T Infrastructure in Universities and Higher Educational Institutions Government of India"",,,Tata Consultancy Services,";;;;;;;;;;;;;;;;;;;;;;;;;;;;;;;;;;;;;;;;;;;;;;;;;;;;;;;;;;;;;;;;;;;
1525,14153063,We would like to express our gratitude towards the unknown potential reviewers who have agreed to review this paper and provided valuable suggestions to improve the quality of the paper.,,,,,,;;;;;;;;;;;;;;;;;;;;;;;;;;;;;;;;;;;;;;;;;;;;;;;;;;;;;;;;;;;;;;;;;;;;;;;;;;
1526,14218556,The authors appreciate the financial support provided by Ministerio de Ciencia e Innovacion of Spain (ECO2012-32001).,ECO2012-32001,Ministerio de Ciencia e Innovacion of Spain,,,,;;;;;;;;;;;;;;;;;;;;;;;;;;;;;;;;;;;;;;;;;;;;;;;;;;;;;;;;;;;;;;;;;;;;;;;;;;
1527,14218556,The authors would like to thank our colleague Aurora Calderon-Martinez for her helpful comments and suggestions.,,,Aurora Calderon-Martinez,,,;;;;;;;;;;;;;;;;;;;;;;;;;;;;;;;;;;;;;;;;;;;;;;;;;;;;;;;;;;;;;;;;;;;;;;;;;;
"1528,14238583,""This work was supported in part by the National Natural Science Foundation of China under Grant 61701071, in part by the China Post-Doctoral Science Foundation under Grant 2017M621129, in part by the Fundamental Research Funds for the Central Universities under Grant DUT16RC(3)119, and in part by the U.S. NSF under Grant CCF 1525904."",DUT16RC(3)119";CCF 1525904;61701071;2017M621129,Fundamental Research Funds for the Central Universities;U.S. NSF;National Natural Science Foundation of China;China Post-Doctoral Science Foundation,,,,;;;;;;;;;;;;;;;;;;;;;;;;;;;;;;;;;;;;;;;;;;;;;;;;;;;;;;;;;;;;;;;;;;;;
1529,14272613,The ESPELMA project is funded by Fundacio La Marato de TV3 (grant number 156/U/2011).,156/U/2011,Fundacio La Marato de TV3,,,,ESPELMA;;;;;;;;;;;;;;;;;;;;;;;;;;;;;;;;;;;;;;;;;;;;;;;;;;;;;;;;;;;;;;;;;;;;;;;;;;
1530,14285679,This research was supported by grants from the Canadian Institutes of Health Research (CIHR) awarded to LS (CIHR Team Grant: TMH-103145) and the National Institute of Child Health and Human Development (NICHD: 1-R01HD40219) awarded to SS.,NICHD: 1-R01HD40219;TMH-103145,National Institute of Child Health and Human Development;Canadian Institutes of Health Research (CIHR),,,,;;;;;;;;;;;;;;;;;;;;;;;;;;;;;;;;;;;;;;;;;;;;;;;;;;;;;;;;;;;;;;;;;;;;;;;;
1531,14285679,RVL and MF had full access to all the data in the study and take responsibility for the integrity and accuracy of the data analysis.,,,,,,;;;;;;;;;;;;;;;;;;;;;;;;;;;;;;;;;;;;;;;;;;;;;;;;;;;;;;;;;;;;;;;;;;;;;;;;;;
"1532,14298735,""This study was financed by Fundacao para a Ciencia e Tecnologia (FCT, grant PTDC/MAR/105276/2008 to MCS)."",PTDC/MAR/105276/2008,Fundacao para a Ciencia e Tecnologia";FCT,,,,;;;;;;;;;;;;;;;;;;;;;;;;;;;;;;;;;;;;;;;;;;;;;;;;;;;;;;;;;;;;;;;;;;;;;;;;;
"1533,14298735,""MCS is supported by the Project """"Genomics and Evolutionary Biology"""", co-financed by the North Portugal Regional Operational Programme 2007/2013 (ON.2 - O Novo Norte), under the National Strategic Reference Framework (NSRF), through the European Regional Development Fund (ERDF)."",,North Portugal Regional Operational Programme 2007/2013";National Strategic Reference Framework (NSRF);"European Regional Development Fund (ERDF),,,,""Project """"Genomics and Evolutionary Biology""""""";;;;;;;;;;;;;;;;;;;;;;;;;;;;;;;;;;;;;;;;;;;;;;;;;;;;;;;;;;;;;;;;;;;;;;;;
1534,14298735,EK and MG are supported by the National Science Centre grant 2012/05/B/NZ4/02410 and by the Institute of Oceanology of the Polish Academy of Sciences statutory research task IV.2.2.,IV.2.2;2012/05/B/NZ4/02410,National Science Centre,,Institute of Oceanology of the Polish Academy of Sciences,,;;;;;;;;;;;;;;;;;;;;;;;;;;;;;;;;;;;;;;;;;;;;;;;;;;;;;;;;;;;;;;;;;;;;;;;;;
1535,14303474,The authors thank Stephanie Bauer and Markus Moessner for their close collaboration and their (technical) support during the ProYouth project and study trial.,,,Stephanie Bauer;Markus Moessner,,,ProYouth;;;;;;;;;;;;;;;;;;;;;;;;;;;;;;;;;;;;;;;;;;;;;;;;;;;;;;;;;;;;;;;;;;;;;;;;;
"1536,14303474,""In addition, they thank Masja Ninck Blok for her contribution in the implementation of Featback and this study's trial."",,,Masja Ninck Blok,,,Featback";;;;;;;;;;;;;;;;;;;;;;;;;;;;;;;;;;;;;;;;;;;;;;;;;;;;;;;;;;;;;;;;;;;;;;;;;;
"1537,14303474,""Finally, they thank all involved patients and therapists for their participation in the study."",,,,,,";;;;;;;;;;;;;;;;;;;;;;;;;;;;;;;;;;;;;;;;;;;;;;;;;;;;;;;;;;;;;;;;;;;;;;;;;;
1538,14303474,This study was supported by a grant from the European Commission's Executive Agency for Health and Consumers in the Health Program (Contract No: 20101209).,20101209,European Commission's Executive Agency for Health and Consumers in the Health Program,,,,;;;;;;;;;;;;;;;;;;;;;;;;;;;;;;;;;;;;;;;;;;;;;;;;;;;;;;;;;;;;;;;;;;;;;;;;;;
1539,14323591,This work was supported by the National Institute of Dental and Craniofacial Research [DE019537].,DE019537,National Institute of Dental and Craniofacial Research,,,,;;;;;;;;;;;;;;;;;;;;;;;;;;;;;;;;;;;;;;;;;;;;;;;;;;;;;;;;;;;;;;;;;;;;;;;;;;
"1540,14323591,""Data from this study have been published elsewhere";" however, the findings published elsewhere are not related to adult adiposity, cortisol reactivity, or snacking behavior."",,,,,,";;;;;;;;;;;;;;;;;;;;;;;;;;;;;;;;;;;;;;;;;;;;;;;;;;;;;;;;;;;;;;;;;;;;;;;;;
1541,14323591,This research is available upon request.,,,,,,;;;;;;;;;;;;;;;;;;;;;;;;;;;;;;;;;;;;;;;;;;;;;;;;;;;;;;;;;;;;;;;;;;;;;;;;;;
1542,14323591,SPSS syntax for all analyses can be found at https://osf.io/zq6tr/.,,,,,,;;;;;;;;;;;;;;;;;;;;;;;;;;;;;;;;;;;;;;;;;;;;;;;;;;;;;;;;;;;;;;;;;;;;;;;;;;
"1543,14353487,""This work was supported by the Enhancing Best Practices through Education, Surveillance, and Policy grant awarded to the Utah Department of Health by the Centers for Disease Control and Prevention, the Huntsman Cancer Foundation, the Colon Cancer Disease-Oriented Research Team at Huntsman Cancer Institute, and the National Cancer Institute of the National Institutes of Health under Award Number P30CA042014, which supports the Genetic Counseling, Biostatistics, and Research Informatics Shared Resources which were used for this project, and Award Number K07CA196985 (YW)."",P30CA042014,""National Cancer Institute of the National Institutes of Health";Huntsman Cancer Foundation;Enhancing Best Practices;"Education, Surveillance, and Policy grant"",,Huntsman Cancer Institute,,""Genetic Counseling, Biostatistics, and Research Informatics Shared Resources""";;;;;;;;;;;;;;;;;;;;;;;;;;;;;;;;;;;;;;;;;;;;;;;;;;;;;;;;;;;;;;;;;;;;;;;
1544,14353487,This study was also supported by grant 8UL1TR000105 (formerly UL1RR025764) from NCATS/NIH.,8UL1TR000105,NCATS/NIH,,,,;;;;;;;;;;;;;;;;;;;;;;;;;;;;;;;;;;;;;;;;;;;;;;;;;;;;;;;;;;;;;;;;;;;;;;;;;;
1545,14353487,The content is solely the responsibility of the authors and does not necessarily represent the official views of the NIH.,,,,,,;;;;;;;;;;;;;;;;;;;;;;;;;;;;;;;;;;;;;;;;;;;;;;;;;;;;;;;;;;;;;;;;;;;;;;;;;;
"1546,14373630,""Natural Sciences and Engineering Research Council of Canada"; Canada Research Chairs;" Research Council of Norway, contract 216416/O10 and by the Norwegian Environmental Agency"",216416/O10,Research Council of Norway";Natural Sciences and Engineering Research Council of Canada;Canada Research Chairs;Norwegian Environmental Agency,,,,;;;;;;;;;;;;;;;;;;;;;;;;;;;;;;;;;;;;;;;;;;;;;;;;;;;;;;;;;;;;;;;;;;;;;
"1547,14415617,""This work is supported by the National Natural Science Foundation of China (Nos. 61573132 and 61403131), Heilongjiang Province Outstanding Youth Fund (JC201412), Chang Jiang Scholar Candidates Program for Provincial Universities in Heilongjiang (No. 2013CJHB005), Science and Technology Innovative Research Team in Higher Educational Institutions of Heilongjiang Province (No. 2012TD007), and """"Information Fusion Estimation and Detection"""" Provincial Key Laboratory."",2012TD007";61573132;61403131;JC201412;"2013CJHB005,""Science and Technology Innovative Research Team in Higher Educational Institutions of Heilongjiang Province";National Natural Science Foundation of China;Heilongjiang Province Outstanding Youth Fund;Chang Jiang Scholar Candidates Program for Provincial Universities in Heilongjiang;"Information Fusion Estimation and Detection"""" Provincial Key Laboratory"",,,,";;;;;;;;;;;;;;;;;;;;;;;;;;;;;;;;;;;;;;;;;;;;;;;;;;;;;;;;;;;;;;;;;;
1548,14452143,The longitudinal survey was funded by the Government of Canada through a grant from Global Affairs Canada (Grant no. S065653).,S065653,Government of Canada;Global Affairs Canada,,,,;;;;;;;;;;;;;;;;;;;;;;;;;;;;;;;;;;;;;;;;;;;;;;;;;;;;;;;;;;;;;;;;;;;;;;;;;
1549,14452143,Funding for the intervention was provided through the RISING program at the Population Council in New York.,,RISING;Population Council in New York,,,,;;;;;;;;;;;;;;;;;;;;;;;;;;;;;;;;;;;;;;;;;;;;;;;;;;;;;;;;;;;;;;;;;;;;;;;;;
1550,14452143,The staff at the Population Council in Ghana conducted the financial literacy training.,,,,,,Population Council in Ghana;;;;;;;;;;;;;;;;;;;;;;;;;;;;;;;;;;;;;;;;;;;;;;;;;;;;;;;;;;;;;;;;;;;;;;;;;;
